{
  "schemaVersion": 1,
  "id": "design-preview",
  "title": "OSF Director",
  "description": "A development fixture for the refined menu layout. These settings only change the preview.",
  "groups": {
    "Playback": [
      { "key": "autoAdvance", "type": "bool", "label": "Auto-advance stages", "hint": "Automatically move to the next stage when its duration ends. Turn this off to advance stages manually.", "default": true },
      { "key": "loopFinal", "type": "bool", "label": "Loop final stage", "hint": "Keep the final stage playing until you choose to end the scene.", "default": false },
      { "key": "notifications", "type": "bool", "label": "Scene notifications", "hint": "Show a brief notification when a scene starts or finishes.", "default": true },
      { "key": "lockMovement", "type": "bool", "label": "Lock movement", "hint": "Keep the player in place while the scene is running.", "default": true },
      { "key": "smoothTransitions", "type": "bool", "label": "Smooth transitions", "hint": "Blend between stages for a more natural transition.", "default": true },
      { "key": "restoreView", "type": "bool", "label": "Restore view after playback", "hint": "Return to your previous camera view when the scene ends.", "default": true }
    ],
    "Camera": [
      { "key": "freeCamera", "type": "bool", "label": "Free camera", "hint": "Move the camera independently during playback.", "default": false },
      { "key": "hideHUD", "type": "bool", "label": "Hide HUD during scenes", "hint": "Keep the scene clear of interface elements.", "default": true }
    ],
    "Controls": [
      { "key": "hotkeys", "type": "bool", "label": "Enable playback shortcuts", "hint": "Use keyboard shortcuts to advance or end playback.", "default": true },
      { "key": "toggleKey", "type": "key", "label": "Toggle playback key", "hint": "Choose one keyboard key to toggle playback. This preview does not dispatch hotkeys.", "default": "F4", "allowUnbound": true },
      { "key": "advanceKey", "type": "key", "label": "Advance stage key", "hint": "A required binding; this setting cannot be cleared.", "default": 13 }
    ],
    "Advanced": [
      { "key": "debug", "type": "bool", "label": "Diagnostic logging", "hint": "Include additional details in the log while troubleshooting a scene.", "default": false, "requires": "restart" },
      { "key": "language", "type": "string", "label": "Language", "default": "auto", "maxLength": 32, "hint": "Use auto for Starfield's language, or enter a locale such as en, de, or pt-BR. This preview does not change OSF UI." }
    ]
  }
}
